{
  "$schema": "https://json-schema.org/draft/2020-12/schema",
  "$id": "https://nutriapp.internal/schemas/water_intake_logged.v1.json",
  "title": "WaterIntakeLogged",
  "type": "object",
  "required": ["event_id", "aggregate_id", "event_type", "version", "occurred_at", "payload", "metadata"],
  "properties": {
    "event_id": { "type": "string", "format": "uuid" },
    "aggregate_id": { "type": "string", "format": "uuid" },
    "event_type": { "const": "WaterIntakeLogged" },
    "version": { "const": 1 },
    "occurred_at": { "type": "string", "format": "date-time" },
    "payload": {
      "type": "object",
      "required": ["intake_id", "user_id", "amount_ml", "occurred_at"],
      "properties": {
        "intake_id": { "type": "string", "format": "uuid" },
        "user_id": { "type": "string", "format": "uuid" },
        "amount_ml": { "type": "number", "exclusiveMinimum": 0 },
        "occurred_at": { "type": "string", "format": "date-time" }
      },
      "additionalProperties": false
    },
    "metadata": {
      "type": "object",
      "required": ["correlation_id"],
      "properties": {
        "correlation_id": { "type": "string" },
        "causation_id": { "type": ["string", "null"] },
        "user_id": { "type": ["string", "null"] }
      },
      "additionalProperties": false
    }
  },
  "additionalProperties": false
}
