{
  "event_id": "55555555-5555-5555-5555-555555555553",
  "aggregate_id": "88888888-8888-8888-8888-888888888881",
  "event_type": "WaterIntakeLogged",
  "version": 1,
  "occurred_at": "2026-08-28T10:00:00+00:00",
  "payload": {
    "intake_id": "88888888-8888-8888-8888-888888888881",
    "user_id": "22222222-2222-2222-2222-222222222222",
    "amount_ml": 250.0,
    "occurred_at": "2026-08-28T10:00:00+00:00"
  },
  "metadata": {
    "correlation_id": "77777777-7777-7777-7777-777777777773",
    "causation_id": "77777777-7777-7777-7777-777777777773",
    "user_id": "22222222-2222-2222-2222-222222222222"
  }
}

